{
  "$schema": "http://json-schema.org/draft-07/schema#",
  "$id": "https://shipledger.dev/schemas/changeset.schema.json",
  "type": "object",
  "additionalProperties": false,
  "required": ["version", "id", "source", "items", "ranges"],
  "properties": {
    "version": { "const": 1 },
    "id": { "type": "string", "minLength": 1 },
    "source": {
      "type": "object",
      "additionalProperties": false,
      "required": ["kind", "ref", "fetchedAt"],
      "properties": {
        "kind": { "type": "string", "minLength": 1 },
        "ref": { "type": "string", "minLength": 1 },
        "fetchedAt": { "type": "string", "format": "date-time" }
      }
    },
    "items": {
      "type": "array",
      "items": {
        "type": "object",
        "additionalProperties": false,
        "required": ["id", "title", "type", "status", "tokens"],
        "properties": {
          "id": { "type": "string", "minLength": 1 },
          "title": { "type": "string" },
          "type": { "type": "string" },
          "status": { "type": "string" },
          "url": { "type": "string" },
          "tokens": {
            "type": "array",
            "minItems": 1,
            "items": {
              "type": "object",
              "additionalProperties": false,
              "required": ["matcher", "token"],
              "properties": {
                "matcher": { "type": "string", "minLength": 1 },
                "token": { "type": "string", "minLength": 1 },
                "repo": { "type": "string", "minLength": 1 }
              }
            }
          }
        }
      }
    },
    "links": {
      "type": "object",
      "additionalProperties": false,
      "properties": {
        "repos": {
          "type": "object",
          "additionalProperties": {
            "type": "object",
            "additionalProperties": false,
            "properties": {
              "commit": { "type": "string", "minLength": 1 },
              "references": {
                "type": "object",
                "additionalProperties": { "type": "string", "minLength": 1 }
              }
            }
          }
        }
      }
    },
    "ranges": {
      "type": "array",
      "minItems": 1,
      "items": {
        "type": "object",
        "additionalProperties": false,
        "required": ["repo", "base", "head"],
        "properties": {
          "repo": { "type": "string", "minLength": 1 },
          "base": { "type": "string", "minLength": 1 },
          "head": { "type": "string", "minLength": 1 },
          "include": { "type": "array", "items": { "type": "string" } }
        }
      }
    }
  }
}
